[{"key": "semgrep:yaml.github-actions.security.github-actions-mutable-action-tag.github-actions-mutable-action-tag:.github/workflows/export-sonar-report.yml:51", "title": "github-actions-mutable-action-tag (.github/workflows/export-sonar-report.yml:51)", "severity": "MEDIUM", "component": ".github/workflows/export-sonar-report.yml", "line": 51, "message": "GitHub Actions step uses a mutable tag or branch reference. Tags and branch names can be silently repointed by the action owner, enabling supply-chain attacks \u2014 as seen in the trivy-action and kics-github-action compromises. Pin the reference to a full 40-character commit SHA instead, e.g. `uses: actions/checkout@8ade135a41bc03ea155e62e844d188df1ea18608`.", "finding_type": "vulnerability", "deep_link": "https://semgrep.dev/r/yaml.github-actions.security.github-actions-mutable-action-tag.github-actions-mutable-action-tag", "source_tool": "semgrep", "branch": "main", "commit_sha": "ead7378d7a0af81ae8b2151e91b387da02c95d83", "repo_full_name": "Prakrit-Mohanty/Gozurion", "default_branch": "main", "how_to_fix": null, "rule_key": "yaml.github-actions.security.github-actions-mutable-action-tag.github-actions-mutable-action-tag", "llm_explanation": null, "code_snippet": null, "code_snippet_start_line": null}, {"key": "semgrep:yaml.github-actions.security.github-actions-mutable-action-tag.github-actions-mutable-action-tag:.github/workflows/export-sonar-report.yml:56", "title": "github-actions-mutable-action-tag (.github/workflows/export-sonar-report.yml:56)", "severity": "MEDIUM", "component": ".github/workflows/export-sonar-report.yml", "line": 56, "message": "GitHub Actions step uses a mutable tag or branch reference. Tags and branch names can be silently repointed by the action owner, enabling supply-chain attacks \u2014 as seen in the trivy-action and kics-github-action compromises. Pin the reference to a full 40-character commit SHA instead, e.g. `uses: actions/checkout@8ade135a41bc03ea155e62e844d188df1ea18608`.", "finding_type": "vulnerability", "deep_link": "https://semgrep.dev/r/yaml.github-actions.security.github-actions-mutable-action-tag.github-actions-mutable-action-tag", "source_tool": "semgrep", "branch": "main", "commit_sha": "ead7378d7a0af81ae8b2151e91b387da02c95d83", "repo_full_name": "Prakrit-Mohanty/Gozurion", "default_branch": "main", "how_to_fix": null, "rule_key": "yaml.github-actions.security.github-actions-mutable-action-tag.github-actions-mutable-action-tag", "llm_explanation": null, "code_snippet": null, "code_snippet_start_line": null}, {"key": "semgrep:yaml.github-actions.security.gha-curl-pipe-shell.gha-curl-pipe-shell:.github/workflows/export-sonar-report.yml:66", "title": "gha-curl-pipe-shell (.github/workflows/export-sonar-report.yml:66)", "severity": "HIGH", "component": ".github/workflows/export-sonar-report.yml", "line": 66, "message": "A `run:` step pipes the output of `curl` or `wget` directly into a shell interpreter. This is the \"curl | bash\" install pattern \u2014 if the remote server is compromised or the URL is hijacked, an attacker can execute arbitrary code in your CI runner. Consider downloading the file first, verifying its checksum or signature, and then executing it.", "finding_type": "vulnerability", "deep_link": "https://semgrep.dev/r/yaml.github-actions.security.gha-curl-pipe-shell.gha-curl-pipe-shell", "source_tool": "semgrep", "branch": "main", "commit_sha": "ead7378d7a0af81ae8b2151e91b387da02c95d83", "repo_full_name": "Prakrit-Mohanty/Gozurion", "default_branch": "main", "how_to_fix": null, "rule_key": "yaml.github-actions.security.gha-curl-pipe-shell.gha-curl-pipe-shell", "llm_explanation": null, "code_snippet": null, "code_snippet_start_line": null}, {"key": "semgrep:yaml.github-actions.security.github-actions-mutable-action-tag.github-actions-mutable-action-tag:.github/workflows/export-sonar-report.yml:71", "title": "github-actions-mutable-action-tag (.github/workflows/export-sonar-report.yml:71)", "severity": "MEDIUM", "component": ".github/workflows/export-sonar-report.yml", "line": 71, "message": "GitHub Actions step uses a mutable tag or branch reference. Tags and branch names can be silently repointed by the action owner, enabling supply-chain attacks \u2014 as seen in the trivy-action and kics-github-action compromises. Pin the reference to a full 40-character commit SHA instead, e.g. `uses: actions/checkout@8ade135a41bc03ea155e62e844d188df1ea18608`.", "finding_type": "vulnerability", "deep_link": "https://semgrep.dev/r/yaml.github-actions.security.github-actions-mutable-action-tag.github-actions-mutable-action-tag", "source_tool": "semgrep", "branch": "main", "commit_sha": "ead7378d7a0af81ae8b2151e91b387da02c95d83", "repo_full_name": "Prakrit-Mohanty/Gozurion", "default_branch": "main", "how_to_fix": null, "rule_key": "yaml.github-actions.security.github-actions-mutable-action-tag.github-actions-mutable-action-tag", "llm_explanation": null, "code_snippet": null, "code_snippet_start_line": null}, {"key": "semgrep:python.lang.security.insecure-hash-algorithms.insecure-hash-algorithm-sha1:ticket/base.py:33", "title": "insecure-hash-algorithm-sha1 (ticket/base.py:33)", "severity": "MEDIUM", "component": "ticket/base.py", "line": 33, "message": "Detected SHA1 hash algorithm which is considered insecure. SHA1 is not collision resistant and is therefore not suitable as a cryptographic signature. Use SHA256 or SHA3 instead.", "finding_type": "vulnerability", "deep_link": "https://semgrep.dev/r/python.lang.security.insecure-hash-algorithms.insecure-hash-algorithm-sha1", "source_tool": "semgrep", "branch": "main", "commit_sha": "ead7378d7a0af81ae8b2151e91b387da02c95d83", "repo_full_name": "Prakrit-Mohanty/Gozurion", "default_branch": "main", "how_to_fix": "hashlib.sha256(\"|\".join(parts).encode(\"utf-8\"))", "rule_key": "python.lang.security.insecure-hash-algorithms.insecure-hash-algorithm-sha1", "llm_explanation": null, "code_snippet": null, "code_snippet_start_line": null}]